{
  "attestation": {
    "mode": "Ed25519",
    "payload_sha256": "b4dfe14aed13fddd4f5ef295d8b1f4593b4cb02249359a5ac4f5f945df5f8aa4",
    "public_key_base64": "R1XeX/j66GjniFEO3QifAVCrfRerUf81Qr2/Wddlk9c=",
    "signature_base64": "hSi/Plnu3XGBi3Pq006fih7VSWkQPh9/gBifWJq3AuJr2Z+i71eTzTzAqq2PDEXoqtCpldd7+KSAkmC1UzbBAA==",
    "signer_fingerprint_sha256": "aab09c9a9e2586699021cba3d7e7d1e6300267e90c922b07fdd9eb3081199148",
    "trust_note": "Verification proves possession of this key. Identity requires an independently trusted fingerprint."
  },
  "created_utc": "2026-07-13T00:00:00Z",
  "diagnostics": {
    "after": [
      {
        "id": "bound:forecast_a:lower",
        "lhs": 0.5,
        "relation": ">=",
        "rhs": 0.0,
        "satisfied": true,
        "source": "forecast_a >= 0.0",
        "violation": 0.0
      },
      {
        "id": "bound:forecast_a:upper",
        "lhs": 0.5,
        "relation": "<=",
        "rhs": 1.0,
        "satisfied": true,
        "source": "forecast_a <= 1.0",
        "violation": 0.0
      },
      {
        "id": "bound:forecast_b:lower",
        "lhs": 0.3,
        "relation": ">=",
        "rhs": 0.0,
        "satisfied": true,
        "source": "forecast_b >= 0.0",
        "violation": 0.0
      },
      {
        "id": "bound:forecast_b:upper",
        "lhs": 0.3,
        "relation": "<=",
        "rhs": 1.0,
        "satisfied": true,
        "source": "forecast_b <= 1.0",
        "violation": 0.0
      },
      {
        "id": "bound:forecast_c:lower",
        "lhs": 0.2,
        "relation": ">=",
        "rhs": 0.0,
        "satisfied": true,
        "source": "forecast_c >= 0.0",
        "violation": 0.0
      },
      {
        "id": "bound:forecast_c:upper",
        "lhs": 0.2,
        "relation": "<=",
        "rhs": 1.0,
        "satisfied": true,
        "source": "forecast_c <= 1.0",
        "violation": 0.0
      },
      {
        "id": "allocation-total",
        "lhs": 1.0,
        "relation": "==",
        "rhs": 1.0,
        "satisfied": true,
        "source": "forecast_a + forecast_b + forecast_c == 1",
        "violation": 0.0
      }
    ],
    "before": [
      {
        "id": "bound:forecast_a:lower",
        "lhs": 0.55,
        "relation": ">=",
        "rhs": 0.0,
        "satisfied": true,
        "source": "forecast_a >= 0.0",
        "violation": 0.0
      },
      {
        "id": "bound:forecast_a:upper",
        "lhs": 0.55,
        "relation": "<=",
        "rhs": 1.0,
        "satisfied": true,
        "source": "forecast_a <= 1.0",
        "violation": 0.0
      },
      {
        "id": "bound:forecast_b:lower",
        "lhs": 0.35,
        "relation": ">=",
        "rhs": 0.0,
        "satisfied": true,
        "source": "forecast_b >= 0.0",
        "violation": 0.0
      },
      {
        "id": "bound:forecast_b:upper",
        "lhs": 0.35,
        "relation": "<=",
        "rhs": 1.0,
        "satisfied": true,
        "source": "forecast_b <= 1.0",
        "violation": 0.0
      },
      {
        "id": "bound:forecast_c:lower",
        "lhs": 0.2,
        "relation": ">=",
        "rhs": 0.0,
        "satisfied": true,
        "source": "forecast_c >= 0.0",
        "violation": 0.0
      },
      {
        "id": "bound:forecast_c:upper",
        "lhs": 0.2,
        "relation": "<=",
        "rhs": 1.0,
        "satisfied": true,
        "source": "forecast_c <= 1.0",
        "violation": 0.0
      },
      {
        "id": "allocation-total",
        "lhs": 1.1,
        "relation": "==",
        "rhs": 1.0,
        "satisfied": false,
        "source": "forecast_a + forecast_b + forecast_c == 1",
        "violation": 0.1
      }
    ]
  },
  "engine": {
    "algorithm": "dykstra-l2-v1",
    "iterations": 2,
    "max_iterations": 20000,
    "name": "EQ-Proof",
    "tolerance": 1e-10,
    "version": "1.4.0"
  },
  "proof_schema": "eq-proof/proof@1",
  "result": {
    "max_violation_after": 0.0,
    "max_violation_before": 0.1,
    "movement_l2": 0.0707106781186548,
    "objective_value": 0.0025,
    "status": "repaired",
    "values": {
      "forecast_a": 0.5,
      "forecast_b": 0.3,
      "forecast_c": 0.2
    }
  },
  "specification": {
    "digest_sha256": "479993b4f52d752b7d1d1043fe3613d67ee5c31b4b70a487ebfabce7d61490a7",
    "document": {
      "description": "Repair an allocation to 100% while preserving the approved reserve.",
      "equations": [
        {
          "description": "The complete allocation must equal 100%.",
          "expression": "forecast_a + forecast_b + forecast_c == 1",
          "id": "allocation-total"
        }
      ],
      "metadata": {
        "domain": "forecasting",
        "owner": "portfolio-controls"
      },
      "name": "portfolio-allocation",
      "schema_version": "1.0",
      "variables": {
        "forecast_a": {
          "label": "Forecast A",
          "lower": 0,
          "unit": "share",
          "upper": 1
        },
        "forecast_b": {
          "label": "Forecast B",
          "lower": 0,
          "unit": "share",
          "upper": 1
        },
        "forecast_c": {
          "fixed": true,
          "label": "Approved reserve",
          "lower": 0,
          "unit": "share",
          "upper": 1
        }
      }
    },
    "name": "portfolio-allocation",
    "schema_version": "1.0"
  },
  "submission": {
    "digest_sha256": "19cfabb3970db06a31079038a8ef9a286f8e963ee2ed3d16414df9b7f065e73b",
    "values": {
      "forecast_a": 0.55,
      "forecast_b": 0.35,
      "forecast_c": 0.2
    }
  }
}
